{
  "id": "cuban-sandwich",
  "title": "Cuban Sandwich",
  "story": "",
  "category": "Entrees",
  "status": "backlog",
  "servings": "",
  "prepTime": "",
  "cookTime": "",
  "totalTime": "",
  "ingredientGroups": [],
  "instructionGroups": [],
  "ifYouFeelLikeIt": [],
  "storage": "",
  "tags": ["anchor", "needs-content"]
}
