{
  "id": "green-beans",
  "title": "Green Beans",
  "story": "",
  "category": "Sides",
  "status": "backlog",
  "servings": "",
  "prepTime": "",
  "cookTime": "",
  "totalTime": "",
  "ingredientGroups": [],
  "instructionGroups": [],
  "ifYouFeelLikeIt": [],
  "storage": "",
  "tags": ["anchor", "needs-content"]
}
