{
  "id": "bennys-holiday-tea",
  "title": "Benny's Holiday Tea",
  "story": "NOTE: this recipe should explain the individual tea blend components so readers in other regions can substitute — don't just list a branded blend name.",
  "category": "Non-Alcoholic Beverages",
  "status": "backlog",
  "servings": "",
  "prepTime": "",
  "cookTime": "",
  "totalTime": "",
  "ingredientGroups": [],
  "instructionGroups": [],
  "ifYouFeelLikeIt": [],
  "storage": "",
  "tags": ["anchor", "needs-content"]
}
